{
  "schema_version": "6.0",
  "locale": "zh-CN",
  "page_type": "cinematic hospitality landing page",
  "visual_voice": ["cinematic", "quiet luxury", "Shanghai editorial", "material hospitality"],
  "user_preferences": ["使用 motion-site-chinese-web-design-v6 完成全页中文字体设计", "与 motion-site-art-directed-v10 的全屏视频和章节结构共同工作"],
  "integration_contract": {
    "art_direction_owner": "existing-project",
    "input_page_plan": "study/page-plan.json",
    "host_hero_mode": "cinematic-full-bleed",
    "layout_locked": true,
    "media_locked": true,
    "section_structure_locked": true,
    "art_direction_locked": true,
    "allowed_changes": ["font_files", "font_tokens", "font_metrics", "text_color_tokens", "line_break_proposals", "fallbacks", "font_loading", "copy_zone_width", "local_grid_span", "local_alignment", "section_padding", "section_min_height"],
    "applied_out_of_scope_changes": []
  },
  "global_hierarchy": {
    "expressive_required": true,
    "signature_intent": "script-floral",
    "script_signature_required": true,
    "rich_script_required": false,
    "signature_module": "editorial_quote",
    "signature_font_id": "long-cang",
    "signature_style_category": "calligraphic",
    "signature_coverage": "full-primary-phrase",
    "first_visual_language": "Chinese",
    "hierarchy_reason": "以龙藏体承担页面的作者性题词，让上海的雨、梧桐和夜泊成为书写回声；风雅宋负责电影题名，阅读区保持克制宋体。",
    "repetition_policy": "龙藏体只重复在短题词、短引语和品牌落款，不进入导航与长正文；风雅宋只负责标题层级，阅读和界面统一由霞鹜新致宋保护。"
  },
  "expressive_distribution": {
    "mode": "distributed",
    "expressive_surface_ids": ["manifesto-quote", "timeline-afternoon-title", "stay-two-quote", "stay-three-caption", "selector-detail-title", "footer-brand"],
    "non_hero_expressive_surface_ids": ["manifesto-quote", "timeline-afternoon-title", "stay-two-quote", "stay-three-caption", "selector-detail-title", "footer-brand"],
    "expressive_module_types": ["editorial_quote"],
    "expressive_page_regions": ["manifesto", "lane", "ritual", "choose", "footer"],
    "reading_protected_surface_ids": ["hero-intro", "manifesto-body", "timeline-dawn-body", "timeline-afternoon-body", "timeline-night-body", "stay-one-body", "stay-two-body", "stay-three-body", "selector-intro", "selector-detail-body", "selector-detail-facts", "final-body", "dialog-intro", "dialog-fields", "footer-legal"],
    "expressive_font_ids": ["long-cang"],
    "min_non_hero_expressive_surfaces": 6,
    "max_active_families": 3,
    "distribution_reason": "表现性书写体跨越宣言、时间线、里弄引语、客房仪式、选择器与页脚六处表面，形成分布式节奏；连续阅读和小型操作表面不使用花体。"
  },
  "coverage_audit": {
    "scope": "full-page",
    "dom_marker_attribute": "data-type-surface",
    "visible_text_surface_ids": ["brand-mark", "choose-eyebrow", "dialog-close", "dialog-eyebrow", "dialog-fields", "dialog-intro", "dialog-title", "final-body", "final-cta", "final-eyebrow", "final-title", "final-video-control", "footer-brand", "footer-legal", "footer-nav", "hero-eyebrow", "hero-intro", "hero-primary-cta", "hero-scroll-label", "hero-secondary-cta", "hero-title", "hero-video-control", "lane-media-control", "manifesto-body", "manifesto-eyebrow", "manifesto-quote", "menu-toggle", "mobile-motion-toggle", "mobile-nav", "motion-toggle", "nav-cta", "primary-nav", "ritual-eyebrow", "ritual-media-caption", "river-eyebrow", "selector-cta", "selector-detail-body", "selector-detail-facts", "selector-detail-label", "selector-detail-title", "selector-intro", "selector-tabs", "selector-title", "skip-link", "stay-one-body", "stay-one-link", "stay-one-meta", "stay-one-title", "stay-three-body", "stay-three-caption", "stay-three-title", "stay-two-body", "stay-two-eyebrow", "stay-two-meta", "stay-two-quote", "stay-two-title", "timeline-afternoon-body", "timeline-afternoon-time", "timeline-afternoon-title", "timeline-dawn-body", "timeline-dawn-time", "timeline-dawn-title", "timeline-night-body", "timeline-night-time", "timeline-night-title"],
    "covered_text_surface_ids": ["brand-mark", "choose-eyebrow", "dialog-close", "dialog-eyebrow", "dialog-fields", "dialog-intro", "dialog-title", "final-body", "final-cta", "final-eyebrow", "final-title", "final-video-control", "footer-brand", "footer-legal", "footer-nav", "hero-eyebrow", "hero-intro", "hero-primary-cta", "hero-scroll-label", "hero-secondary-cta", "hero-title", "hero-video-control", "lane-media-control", "manifesto-body", "manifesto-eyebrow", "manifesto-quote", "menu-toggle", "mobile-motion-toggle", "mobile-nav", "motion-toggle", "nav-cta", "primary-nav", "ritual-eyebrow", "ritual-media-caption", "river-eyebrow", "selector-cta", "selector-detail-body", "selector-detail-facts", "selector-detail-label", "selector-detail-title", "selector-intro", "selector-tabs", "selector-title", "skip-link", "stay-one-body", "stay-one-link", "stay-one-meta", "stay-one-title", "stay-three-body", "stay-three-caption", "stay-three-title", "stay-two-body", "stay-two-eyebrow", "stay-two-meta", "stay-two-quote", "stay-two-title", "timeline-afternoon-body", "timeline-afternoon-time", "timeline-afternoon-title", "timeline-dawn-body", "timeline-dawn-time", "timeline-dawn-title", "timeline-night-body", "timeline-night-time", "timeline-night-title"],
    "uncovered_text_surface_ids": [],
    "coverage_reason": "最终 HTML 默认状态的 65 个可见文字表面各自拥有唯一 data-type-surface 标记，并由下列九个语义模块完整且不重复地接管；提交后状态沿用表单模块字体。"
  },
  "modules": [
    {
      "module_id": "brand_mark",
      "selector": ".brand",
      "surface_ids": ["brand-mark"],
      "page_regions": ["header"],
      "text": "沪上住志 SHANGHAI STAY NOTES",
      "font_id": "maoken-fengyasong",
      "font_family": "MaoKenWang FengYaSong",
      "style_category": "serif-editorial",
      "visual_priority": "utility",
      "role_reason": "小型品牌字保持与主标题同源的编辑骨架，但不抢夺首屏题名。",
      "art_direction_relationship": "保持固定导航和全屏媒体结构，只替换字形与字距。",
      "font_weight": 400,
      "font_size": "21px–23px",
      "line_height": 1,
      "letter_spacing": "0.01em",
      "max_width": "16em",
      "color": "var(--text)",
      "background": "dark translucent moving video",
      "alignment": "left",
      "allowed_line_breaks": ["沪上住志 / SHANGHAI STAY NOTES"],
      "fallback": ["Songti SC", "serif"],
      "locale_verified": true,
      "font_loaded": true,
      "layout_change_required": false,
      "media_change_required": false,
      "geometry_adjustments": {"state": "unchanged", "changes": [], "evidence": "桌面、平板和手机截图中品牌字均保持单行且不挤压导航。"},
      "license": {"class": "open_source", "source": "https://github.com/maoken-fonts/fengyasong", "verified_for_target": true, "notes": "SIL OFL 1.1；许可证文本已随字体提交。"},
      "rejected_candidates": []
    },
    {
      "module_id": "hero_display",
      "selector": ".hero-title, .final-title",
      "surface_ids": ["hero-title", "final-title"],
      "page_regions": ["hero", "final"],
      "text": "把上海，住成一场电影 / 下一次醒来，在上海。",
      "font_id": "maoken-fengyasong",
      "font_family": "MaoKenWang FengYaSong",
      "style_category": "serif-editorial",
      "visual_priority": "support-display",
      "role_reason": "装饰宋体把酒店主题建立成电影片名，并在结尾完成对称回收。",
      "art_direction_relationship": "题名严格留在 v10 的左侧复制安全区，未移动酒店与天际线主体。",
      "font_weight": 400,
      "font_size": "clamp(58px, 8.25vw, 132px)",
      "line_height": 0.94,
      "letter_spacing": "-0.035em",
      "max_width": "5.25em",
      "color": "var(--text)",
      "background": "dark Shanghai hotel video and calm closing field",
      "alignment": "left",
      "allowed_line_breaks": ["把上海， / 住成一场电影", "phone: 把上海， / 住成一场 / 电影", "下一次醒来， / 在上海。"],
      "fallback": ["Songti SC", "serif"],
      "locale_verified": true,
      "font_loaded": true,
      "layout_change_required": false,
      "media_change_required": false,
      "geometry_adjustments": {"state": "approved", "changes": ["headline_max_width", "explicit_line_breaks"], "evidence": "真实字形 QA 后固定 Hero 与结尾的语义断行；手机结尾从三行单字阶梯收敛为两条完整短句。"},
      "line_break_checks": {
        "desktop_lines": ["把上海，", "住成一场电影"],
        "phone_lines": ["把上海，", "住成一场", "电影"],
        "desktop_fit": {"surface_id": "hero-title", "viewport_width_px": 1440, "available_width_px": 604.8, "longest_line_width_px": 395.5, "ratio": 0.654},
        "phone_fit": {"surface_id": "hero-title", "viewport_width_px": 390, "available_width_px": 350, "longest_line_width_px": 246.7, "ratio": 0.705},
        "measurement_method": "使用最终提交的 maoken-fengyasong.ttf 和最终 CSS，在 1440px 与 390px 页面容器内读取真实 glyph Range 宽度。",
        "single_character_line_intentional": false,
        "punctuation_only_line": false,
        "evidence": "qa/hero-playing-desktop.png 与 qa/hero-phone.png 均无单字阶梯或标点孤行。"
      },
      "license": {"class": "open_source", "source": "https://github.com/maoken-fonts/fengyasong", "verified_for_target": true},
      "rejected_candidates": [
        {"font_id": "ma-shan-zheng", "style_category": "calligraphic", "font_loaded": true, "rendered_reason": "A 版真实字形笔锋在酒店视频上显得过急，整句轮廓更接近文化活动题字，削弱室内材质的安静对比。", "screenshot": "qa/font-lab-desktop.png"},
        {"font_id": "smiley-sans", "style_category": "rounded-playful", "font_loaded": true, "rendered_reason": "B 版真实窄黑字在截图中具有强海报速度，但轮廓偏年轻消费，无法回应黄铜、亚麻和雨夜媒体。", "screenshot": "qa/font-lab-phone.png"}
      ]
    },
    {
      "module_id": "section_heading",
      "selector": ".stay-title, .choose-title, .time-rail strong:not(.script), .inquiry-dialog h2",
      "surface_ids": ["timeline-dawn-title", "timeline-night-title", "stay-one-title", "stay-two-title", "stay-three-title", "selector-title", "dialog-title"],
      "page_regions": ["manifesto", "river", "lane", "ritual", "choose", "dialog"],
      "text": "江岸初醒 / 苏河夜泊 / 云与水，同时醒来 / 转进里弄，住进一方安静 / 把讲究，藏进一杯热茶 / 今晚，你想住在哪里？ / 定制沪上住法",
      "font_id": "maoken-fengyasong",
      "font_family": "MaoKenWang FengYaSong",
      "style_category": "serif-editorial",
      "visual_priority": "support-display",
      "role_reason": "同一装饰宋体把三种住法和选择器编成一致的杂志章节序列。",
      "art_direction_relationship": "只在各章既定文案列中调整字号上限和标题宽度，不改变媒体盒或宏观网格。",
      "font_weight": 400,
      "font_size": "clamp(52px, 5.4vw, 88px)",